<?xml version="1.0" encoding="iso-8859-1"?>
<!DOCTYPE rules PUBLIC "-//W3C//DTD GrammarRules 0.1//EN" "rules.dtd">
<!--
Rules: Words that should not be used
(c) 2001,2002 Daniel Naber, daniel.naber@t-online.de, 2001-12-30
$Id: words.xml,v 1.1.1.1 2003-05-19 00:09:52 dnaber Exp $
-->
<rules>

	<!-- <collection name="Deprecated words"> -->
	<!-- todo: use thousand million instead of billion -->
	
		<rule id="SHORT_FORMS">
			<!-- fixme: add >'ll< and >'s< (but only for 'it'???) too -->
			<!-- the tokenizer splits "don't" into "do n't" because the tagger needs
			it that way, so we use two tokens: -->
			<pattern lang="en">"(do|did|ca|could|wo|would|must|need|should|is|are|was|were)" "n't"</pattern>
			<message>Please use long forms like <em>do not</em> instead of <em>don't</em>
				for formal texts.</message>
			<example type="correct"><em>Do not</em> open the box unless you've read the instructions.</example>
			<example type="incorrect"><em>Don't</em> open the box unless you've read the instructions.</example>
		</rule>

		<!-- TODO: is this really not a false friend??? -->
		<!-- TODO: test! -->
		<!--
		<rule id="WORDS_NEAR">
			<pattern lang="en">'in' 'the' 'near' 'of'</pattern>
			<translation lang="en">near to</translation>
			<translation lang="en">in the vicinity of</translation>
			<message>The idiom <em>in the near of</em> doesn't exist in English.</message>
			<example type="correct">Enter 'foobar' into the form field.</example>
		</rule>
		-->

	<!-- </collection> -->

</rules>
